statement ok
create table t1(id int primary key, c1 int, c2 int);

statement ok
copy t1 from 'tests/data/row_20000.csv' ( DELIMITER '|' );

statement ok
insert into t1 values(100000000, null, null);

statement ok
create unique index u_c1_index on t1 (c1);

statement ok
create index c2_index on t1 (c2);

statement ok
create index p_index on t1 (c1, c2);

statement ok
analyze table t1;

query IIT   
select * from t1 limit 10;
----
0 1 2
3 4 5
6 7 8
9 10 11
12 13 14
15 16 17
18 19 20
21 22 23
24 25 26
27 28 29

query IIT
select * from t1 where id = 0;
----
0 1 2

query IIT
select * from t1 where id = 0 and id = 1;
----

query IIT
select * from t1 where id = 0 and id != 0;
----

query IIT
select * from t1 where id = 0 or id != 0 limit 10;
----
0 1 2
3 4 5
6 7 8
9 10 11
12 13 14
15 16 17
18 19 20
21 22 23
24 25 26
27 28 29

query IIT
select * from t1 where id = 0 and id != 0 and id = 3;
----

query IIT
select * from t1 where id = 0 and id != 0 or id = 3;
----
3 4 5

query IIT
select * from t1 where id > 0 and id = 3;
----
3 4 5

query IIT
select * from t1 where id >= 0 and id <= 3;
----
0 1 2
3 4 5

query IIT
select * from t1 where id <= 0 and id >= 3;
----

query IIT
select * from t1 where (id > 10) = false;
----
0 1 2
3 4 5
6 7 8
9 10 11

query IIT
select * from t1 where (id > 10) != true;
----
0 1 2
3 4 5
6 7 8
9 10 11

query IIT
select * from t1 where not (id > 10);
----
0 1 2
3 4 5
6 7 8
9 10 11

query IIT
select * from t1 where id >= 3 or id <= 9 limit 10;
----
0 1 2
3 4 5
6 7 8
9 10 11
12 13 14
15 16 17
18 19 20
21 22 23
24 25 26
27 28 29

query IIT
select * from t1 where id <= 3 or id >= 9 limit 10;
----
0 1 2
3 4 5
9 10 11
12 13 14
15 16 17
18 19 20
21 22 23
24 25 26
27 28 29
30 31 32

query IIT
select * from t1 where (id >= 0 and id <= 3) or (id >= 9 and id <= 12);
----
0 1 2
3 4 5
9 10 11
12 13 14

query IIT
select * from t1 where (id >= 0 or id <= 3) and (id >= 9 or id <= 12) limit 10;
----
0 1 2
3 4 5
6 7 8
9 10 11
12 13 14
15 16 17
18 19 20
21 22 23
24 25 26
27 28 29

query IIT
select * from t1 where id = 5 or (id > 5 and (id > 6 or id < 8) and id < 12);
----
6 7 8
9 10 11

query IIT
select * from t1 where c1 = 7 and c2 = 8;
----
6 7 8

query IIT
select * from t1 where c1 = 7 and c2 < 9;
----
6 7 8

query IIT
select * from t1 where (c1 = 7 or c1 = 10) and c2 < 9;
----
6 7 8

query IIT
select * from t1 where c1 is null and c2 is null;
----
100000000 null null

query IIT
select * from t1 where c1 > 0 and c1 < 8;
----
0 1 2
3 4 5
6 7 8

query IIT
select * from t1 where c2 > 0 and c2 < 9;
----
0 1 2
3 4 5
6 7 8

query IIT
select * from t1 where c2 = 5;
----
3 4 5

statement ok
update t1 set c2 = 9 where c1 = 1

query IIT rowsort
select * from t1 where c2 > 0 and c2 < 10;
----
0 1 9
3 4 5
6 7 8

statement ok
delete from t1 where c1 = 4

query IIT rowsort
select * from t1 where c2 > 0 and c2 < 10;
----
0 1 9
6 7 8


# unique covered
query I rowsort
select c1 from t1 where c1 < 10;
----
1
7

# unique covered with primary key projection
query II rowsort
select c1, id from t1 where c1 < 10;
----
1 0
7 6

statement ok
drop index t1.u_c1_index;

# normal covered
query II rowsort
select c2 from t1 where c2 < 10 and c2 > 0;
----
8
9

statement ok
insert into t1 values(100000002, 100000002, 8);

# stream distinct
query I rowsort
select distinct c2 from t1 where c2 < 10 and c2 > 0;
----
8
9

statement ok
delete from t1 where id = 100000002;

statement ok
drop index t1.c2_index;

# composite covered
query II rowsort
select c1, c2 from t1 where c1 < 10 and c1 > 0 and c2 >0 and c2 < 10;
----
1 9
7 8

# composite covered projection reorder
query II rowsort
select c2, c1 from t1 where c1 < 10 and c1 > 0 and c2 > 0 and c2 < 10;
----
8 7
9 1


statement ok
drop table t1;

statement ok
create table t_cover(id int primary key, c1 int, c2 int, c3 int);

statement ok
insert into t_cover values
    (1, 1, 10, 11),
    (2, 2, 20, 21),
    (3, 2, 22, 23),
    (4, 3, 30, 31);

statement ok
create index idx_cover on t_cover (c1, c2, c3);

# composite index trailing columns cover (index columns > output columns)
query II rowsort
select c2, c3 from t_cover where c1 = 2;
----
20 21
22 23

statement ok
drop table t_cover;

# Composite index range bounds
# Composite equality-prefix bounds must include the complete matching prefix
# and distinguish < / <= / > / >= when trailing index columns are present.
statement ok
create table stock_bounds(w smallint, item int, qty smallint, payload int, primary key(w,item));

statement ok
insert into stock_bounds values (1,1,1,10),(1,2,2,20),(1,3,3,30),(1,4,4,40),(1,5,5,50),(1,6,6,60),(1,7,7,70),(1,8,8,80),(1,9,9,90),(1,10,10,100),(1,11,11,110),(1,12,12,120),(1,13,13,130),(1,14,14,140),(1,15,15,150),(1,16,16,160),(1,17,17,170),(1,18,18,180),(1,19,19,190),(1,20,20,200),(1,21,21,210),(1,22,22,220),(1,23,23,230),(1,24,24,240),(1,25,25,250),(1,26,26,260),(1,27,27,270),(1,28,28,280),(1,29,29,290),(1,30,30,300),(1,31,31,310),(1,32,32,320),(1,33,33,330),(1,34,34,340),(1,35,35,350),(1,36,36,360),(1,37,37,370),(1,38,38,380),(1,39,39,390),(1,40,40,400),(1,41,41,410),(1,42,42,420),(1,43,43,430),(1,44,44,440),(1,45,45,450),(1,46,46,460),(1,47,47,470),(1,48,48,480),(1,49,49,490),(1,50,50,500),(1,51,51,510),(1,52,52,520),(1,53,53,530),(1,54,54,540),(1,55,55,550),(1,56,56,560),(1,57,57,570),(1,58,58,580),(1,59,59,590),(1,60,60,600),(1,61,61,610),(1,62,62,620),(1,63,63,630),(1,64,64,640),(1,65,65,650),(1,66,66,660),(1,67,67,670),(1,68,68,680),(1,69,69,690),(1,70,70,700),(1,71,71,710),(1,72,72,720),(1,73,73,730),(1,74,74,740),(1,75,75,750),(1,76,76,760),(1,77,77,770),(1,78,78,780),(1,79,79,790),(1,80,80,800),(1,81,81,810),(1,82,82,820),(1,83,83,830),(1,84,84,840),(1,85,85,850),(1,86,86,860),(1,87,87,870),(1,88,88,880),(1,89,89,890),(1,90,90,900),(1,91,91,910),(1,92,92,920),(1,93,93,930),(1,94,94,940),(1,95,95,950),(1,96,96,960),(1,97,97,970),(1,98,98,980),(1,99,99,990),(1,100,0,1000),(1,101,1,1010),(1,102,2,1020),(1,103,3,1030),(1,104,4,1040),(1,105,5,1050),(1,106,6,1060),(1,107,7,1070),(1,108,8,1080),(1,109,9,1090),(1,110,10,1100),(1,111,11,1110),(1,112,12,1120),(1,113,13,1130),(1,114,14,1140),(1,115,15,1150),(1,116,16,1160),(1,117,17,1170),(1,118,18,1180),(1,119,19,1190),(1,120,20,1200),(1,121,21,1210),(1,122,22,1220),(1,123,23,1230),(1,124,24,1240),(1,125,25,1250),(1,126,26,1260),(1,127,27,1270),(1,128,28,1280),(1,129,29,1290),(1,130,30,1300),(1,131,31,1310),(1,132,32,1320),(1,133,33,1330),(1,134,34,1340),(1,135,35,1350),(1,136,36,1360),(1,137,37,1370),(1,138,38,1380),(1,139,39,1390),(1,140,40,1400),(1,141,41,1410),(1,142,42,1420),(1,143,43,1430),(1,144,44,1440),(1,145,45,1450),(1,146,46,1460),(1,147,47,1470),(1,148,48,1480),(1,149,49,1490),(1,150,50,1500),(1,151,51,1510),(1,152,52,1520),(1,153,53,1530),(1,154,54,1540),(1,155,55,1550),(1,156,56,1560),(1,157,57,1570),(1,158,58,1580),(1,159,59,1590),(1,160,60,1600),(1,161,61,1610),(1,162,62,1620),(1,163,63,1630),(1,164,64,1640),(1,165,65,1650),(1,166,66,1660),(1,167,67,1670),(1,168,68,1680),(1,169,69,1690),(1,170,70,1700),(1,171,71,1710),(1,172,72,1720),(1,173,73,1730),(1,174,74,1740),(1,175,75,1750),(1,176,76,1760),(1,177,77,1770),(1,178,78,1780),(1,179,79,1790),(1,180,80,1800),(1,181,81,1810),(1,182,82,1820),(1,183,83,1830),(1,184,84,1840),(1,185,85,1850),(1,186,86,1860),(1,187,87,1870),(1,188,88,1880),(1,189,89,1890),(1,190,90,1900),(1,191,91,1910),(1,192,92,1920),(1,193,93,1930),(1,194,94,1940),(1,195,95,1950),(1,196,96,1960),(1,197,97,1970),(1,198,98,1980),(1,199,99,1990),(1,200,0,2000);

statement ok
insert into stock_bounds values (0,1,0,1),(2,1,0,1),(2,2,99,2);

statement ok
create index stock_bounds_qty on stock_bounds(w,qty,item);

statement ok
analyze table stock_bounds;

query III
select item,w,qty from stock_bounds where w=1 and qty < 2 order by item;
----
1 1 1
100 1 0
101 1 1
200 1 0

query IIII
select item,w,qty,payload from stock_bounds where w=1 and qty < 2 order by item;
----
1 1 1 10
100 1 0 1000
101 1 1 1010
200 1 0 2000

query III
select item,w,qty from stock_bounds where w=1 and qty <= 2 order by item;
----
1 1 1
2 1 2
100 1 0
101 1 1
102 1 2
200 1 0

query IIII
select item,w,qty,payload from stock_bounds where w=1 and qty <= 2 order by item;
----
1 1 1 10
2 1 2 20
100 1 0 1000
101 1 1 1010
102 1 2 1020
200 1 0 2000

query III
select item,w,qty from stock_bounds where w=1 and qty > 97 order by item;
----
98 1 98
99 1 99
198 1 98
199 1 99

query IIII
select item,w,qty,payload from stock_bounds where w=1 and qty > 97 order by item;
----
98 1 98 980
99 1 99 990
198 1 98 1980
199 1 99 1990

query III
select item,w,qty from stock_bounds where w=1 and qty >= 97 order by item;
----
97 1 97
98 1 98
99 1 99
197 1 97
198 1 98
199 1 99

query IIII
select item,w,qty,payload from stock_bounds where w=1 and qty >= 97 order by item;
----
97 1 97 970
98 1 98 980
99 1 99 990
197 1 97 1970
198 1 98 1980
199 1 99 1990

query III
select item,w,qty from stock_bounds where w=1 and qty = 2 order by item;
----
2 1 2
102 1 2

query IIII
select item,w,qty,payload from stock_bounds where w=1 and qty = 2 order by item;
----
2 1 2 20
102 1 2 1020

query III
select item,w,qty from stock_bounds where w=1 and qty < 0 order by item;
----

query IIII
select item,w,qty,payload from stock_bounds where w=1 and qty < 0 order by item;
----

query III
select item,w,qty from stock_bounds where w=1 and qty > 99 order by item;
----

query IIII
select item,w,qty,payload from stock_bounds where w=1 and qty > 99 order by item;
----

statement ok
update stock_bounds set qty=1 where w=1 and item=50;

query III
select item,w,qty from stock_bounds where w=1 and qty<2 order by item;
----
1 1 1
50 1 1
100 1 0
101 1 1
200 1 0

statement ok
delete from stock_bounds where w=1 and item=101;

query III
select item,w,qty from stock_bounds where w=1 and qty<2 order by item;
----
1 1 1
50 1 1
100 1 0
200 1 0

statement ok
drop table stock_bounds;
